{
  "schema_version": "1.0",
  "course_id": "linear-algebra",
  "license": "MIT OR CC-BY-4.0",
  "questions": [
    {
      "id": "linear-algebra-1:check",
      "type": "numeric",
      "prompt": "Solve x+y=7 and x−y=1. What is x?",
      "points": 1,
      "objective_ids": [
        "linear-algebra-1-objective-1"
      ],
      "solution_spec": {
        "answer": 4,
        "unit": "",
        "tolerance": 0.06,
        "unit_required": false,
        "significant_figures": null,
        "dimensions": null
      },
      "feedback": {
        "hint": "Add the equations to eliminate y.",
        "solution": "Adding gives 2x=8, so x=4 and y=3.",
        "lesson_ids": [
          "linear-algebra-1"
        ],
        "misconception_ids": []
      },
      "visibility": "public-practice-authoring",
      "provenance": {
        "kind": "legacy-prototype",
        "legacy_id": "linear-algebra-1:check",
        "modifications": []
      }
    },
    {
      "id": "linear-algebra-2:check",
      "type": "numeric",
      "prompt": "A planar vector (3,0) is rotated counterclockwise by 90°. What is its new y-coordinate?",
      "points": 1,
      "objective_ids": [
        "linear-algebra-2-objective-1"
      ],
      "solution_spec": {
        "answer": 3,
        "unit": "",
        "tolerance": 0.045,
        "unit_required": false,
        "significant_figures": null,
        "dimensions": null
      },
      "feedback": {
        "hint": "Apply R=[[0,−1],[1,0]] to the vector.",
        "solution": "R[3,0]ᵀ = [0,3]ᵀ, so the new y-coordinate is 3.",
        "lesson_ids": [
          "linear-algebra-2"
        ],
        "misconception_ids": []
      },
      "visibility": "public-practice-authoring",
      "provenance": {
        "kind": "legacy-prototype",
        "legacy_id": "linear-algebra-2:check",
        "modifications": []
      }
    },
    {
      "id": "linear-algebra-3:check",
      "type": "single_choice",
      "prompt": "For a continuous-time linear system ẋ=Ax, what condition guarantees asymptotic stability of the origin?",
      "options": [
        "Every eigenvalue has negative real part",
        "Every eigenvalue is positive",
        "The trace is zero",
        "Every matrix entry is negative"
      ],
      "points": 1,
      "objective_ids": [
        "linear-algebra-3-objective-1"
      ],
      "solution_spec": {
        "answer": 0
      },
      "feedback": {
        "hint": "The modal solutions contain exponential factors e^(λt).",
        "solution": "All eigenvalues with negative real parts produce decaying modes, which is the continuous-time asymptotic-stability condition for a linear system.",
        "lesson_ids": [
          "linear-algebra-3"
        ],
        "misconception_ids": []
      },
      "visibility": "public-practice-authoring",
      "provenance": {
        "kind": "legacy-prototype",
        "legacy_id": "linear-algebra-3:check",
        "modifications": []
      }
    },
    {
      "id": "linear-algebra-4:check",
      "type": "numeric",
      "prompt": "The points (0,2) and (2,6) lie on a line y=a+bx. What is slope b?",
      "points": 1,
      "objective_ids": [
        "linear-algebra-4-objective-1"
      ],
      "solution_spec": {
        "answer": 2,
        "unit": "",
        "tolerance": 0.03,
        "unit_required": false,
        "significant_figures": null,
        "dimensions": null
      },
      "feedback": {
        "hint": "Compute change in y divided by change in x.",
        "solution": "b=(6−2)/(2−0)=2.",
        "lesson_ids": [
          "linear-algebra-4"
        ],
        "misconception_ids": []
      },
      "visibility": "public-practice-authoring",
      "provenance": {
        "kind": "legacy-prototype",
        "legacy_id": "linear-algebra-4:check",
        "modifications": []
      }
    },
    {
      "id": "linear-algebra-1:rank-from-pivots",
      "type": "numeric",
      "prompt": "Row-reduce the matrix with rows (1, 2, 3), (2, 4, 6) and (1, 0, 1). What is its rank? Enter a number.",
      "points": 1,
      "objective_ids": [
        "linear-algebra-1-objective-2"
      ],
      "solution_spec": {
        "answer": 2,
        "unit": "",
        "tolerance": 0.01,
        "unit_required": false,
        "significant_figures": null,
        "dimensions": null
      },
      "feedback": {
        "hint": "Count pivot columns after elimination.",
        "solution": "Row 2 is twice row 1, so it eliminates to zero. Rows 1 and 3 are independent, giving 2 pivots, so the rank is 2. A rank below the number of unknowns means a system with this matrix has either no solution or infinitely many.",
        "lesson_ids": [
          "linear-algebra-1"
        ],
        "misconception_ids": []
      },
      "visibility": "public-practice-authoring",
      "provenance": {
        "kind": "original",
        "modifications": []
      }
    },
    {
      "id": "linear-algebra-2:vector-vs-coordinates",
      "type": "numeric",
      "prompt": "In the basis b₁ = (1, 0), b₂ = (1, 1), a vector has coordinates (3, 1). What is its x-component in the standard basis? Enter a number.",
      "points": 1,
      "objective_ids": [
        "linear-algebra-2-objective-2"
      ],
      "solution_spec": {
        "answer": 4,
        "unit": "",
        "tolerance": 0.01,
        "unit_required": false,
        "significant_figures": null,
        "dimensions": null
      },
      "feedback": {
        "hint": "The vector is 3·b₁ + 1·b₂.",
        "solution": "v = 3(1, 0) + 1(1, 1) = (4, 1). The same geometric vector has different coordinates in different bases, so the numbers (3, 1) and (4, 1) describe one object.",
        "lesson_ids": [
          "linear-algebra-2"
        ],
        "misconception_ids": []
      },
      "visibility": "public-practice-authoring",
      "provenance": {
        "kind": "original",
        "modifications": []
      }
    },
    {
      "id": "linear-algebra-3:mode-by-mode-decay",
      "type": "numeric",
      "prompt": "A system xₖ₊₁ = A xₖ has an eigenvector with eigenvalue 0.8. The component of x along that eigenvector starts at 1.0. What is its size after 3 steps? Enter a number.",
      "points": 1,
      "objective_ids": [
        "linear-algebra-3-objective-2"
      ],
      "solution_spec": {
        "answer": 0.512,
        "unit": "",
        "tolerance": 0.001,
        "unit_required": false,
        "significant_figures": null,
        "dimensions": null
      },
      "feedback": {
        "hint": "Each step multiplies the eigencomponent by its eigenvalue.",
        "solution": "After 3 steps the component is 0.8³ = 0.512. Diagonalization separates the system into independent modes, each scaling by its own eigenvalue.",
        "lesson_ids": [
          "linear-algebra-3"
        ],
        "misconception_ids": []
      },
      "visibility": "public-practice-authoring",
      "provenance": {
        "kind": "original",
        "modifications": []
      }
    },
    {
      "id": "linear-algebra-4:residual-pattern",
      "type": "single_choice",
      "prompt": "A straight-line fit has R² = 0.95, but the residuals are positive at both ends and negative in the middle. What is the best conclusion?",
      "options": [
        "The line is a poor model for the structure: the curved residual pattern shows systematic error that R² does not reveal.",
        "The residuals are random.",
        "The model is validated because R² is high.",
        "More data of the same kind will remove the curvature."
      ],
      "points": 1,
      "objective_ids": [
        "linear-algebra-4-objective-2"
      ],
      "solution_spec": {
        "answer": 0
      },
      "feedback": {
        "hint": "Read the residual pattern, not only R².",
        "solution": "A high R² can coexist with systematic misfit. Curved residuals suggest the functional form is wrong or a variable is missing; a good fit statistic is not evidence the model is adequate.",
        "lesson_ids": [
          "linear-algebra-4"
        ],
        "misconception_ids": []
      },
      "visibility": "public-practice-authoring",
      "provenance": {
        "kind": "original",
        "modifications": []
      }
    }
  ]
}
