{
  "schema_version": "1.0",
  "course_id": "bioreactors",
  "license": "MIT OR CC-BY-4.0",
  "questions": [
    {
      "id": "bioreactors-1:check",
      "type": "numeric",
      "prompt": "A culture doubles every 30 hours. What is its exponential growth rate μ in h⁻¹?",
      "points": 1,
      "objective_ids": [
        "bioreactors-1-objective-1"
      ],
      "solution_spec": {
        "answer": 0.0231,
        "unit": "h⁻¹",
        "tolerance": 0.0005,
        "unit_required": false,
        "significant_figures": null,
        "dimensions": null
      },
      "feedback": {
        "hint": "Use μ=ln2/td and convert td to hours.",
        "solution": "μ=0.693/30=0.0231 h⁻¹.",
        "lesson_ids": [
          "bioreactors-1"
        ],
        "misconception_ids": []
      },
      "visibility": "public-practice-authoring",
      "provenance": {
        "kind": "legacy-prototype",
        "legacy_id": "bioreactors-1:check",
        "modifications": []
      }
    },
    {
      "id": "bioreactors-2:check",
      "type": "numeric",
      "prompt": "A culture has 2×10⁶ cells/mL consuming 1×10⁻¹⁶ mol O₂/(cell·s). What is volumetric demand in mmol/(L·h)?",
      "points": 1,
      "objective_ids": [
        "bioreactors-2-objective-1"
      ],
      "solution_spec": {
        "answer": 0.72,
        "unit": "mmol/(L·h)",
        "tolerance": 0.02,
        "unit_required": false,
        "significant_figures": null,
        "dimensions": null
      },
      "feedback": {
        "hint": "Convert cells/mL to cells/L, then mol/s to mmol/h.",
        "solution": "2×10⁹ cells/L × 1×10⁻¹⁶ mol/(cell·s)=2×10⁻⁷ mol/(L·s). Multiply by 3600 and 1000 to get 0.72 mmol/(L·h).",
        "lesson_ids": [
          "bioreactors-2"
        ],
        "misconception_ids": []
      },
      "visibility": "public-practice-authoring",
      "provenance": {
        "kind": "legacy-prototype",
        "legacy_id": "bioreactors-2:check",
        "modifications": []
      }
    },
    {
      "id": "bioreactors-3:check",
      "type": "single_choice",
      "prompt": "Why is constant tip speed alone insufficient to guarantee equivalent scale-up?",
      "options": [
        "It does not preserve mixing, power input, oxygen transfer, and local stress simultaneously",
        "Tip speed has no units",
        "Cells cannot experience flow",
        "It always decreases vessel volume"
      ],
      "points": 1,
      "objective_ids": [
        "bioreactors-3-objective-1"
      ],
      "solution_spec": {
        "answer": 0
      },
      "feedback": {
        "hint": "Scale-up objectives are coupled; one preserved variable does not fix all transport conditions.",
        "solution": "Equal tip speed does not ensure equal mixing time, power per volume, gas transfer, or local shear; the limiting process must be identified.",
        "lesson_ids": [
          "bioreactors-3"
        ],
        "misconception_ids": []
      },
      "visibility": "public-practice-authoring",
      "provenance": {
        "kind": "legacy-prototype",
        "legacy_id": "bioreactors-3:check",
        "modifications": []
      }
    },
    {
      "id": "bioreactors-4:check",
      "type": "single_choice",
      "prompt": "Which statement best distinguishes a process parameter from a quality attribute?",
      "options": [
        "Agitation rate is a process parameter; potency is a product quality attribute",
        "Both are synonyms for cell count",
        "Potency is always an instrument setting",
        "A process parameter can never affect product quality"
      ],
      "points": 1,
      "objective_ids": [
        "bioreactors-4-objective-1"
      ],
      "solution_spec": {
        "answer": 0
      },
      "feedback": {
        "hint": "One describes how the process is run; the other describes the resulting product or function.",
        "solution": "Agitation rate is a controlled process condition; potency is a measurable characteristic of the resulting cell or tissue product.",
        "lesson_ids": [
          "bioreactors-4"
        ],
        "misconception_ids": []
      },
      "visibility": "public-practice-authoring",
      "provenance": {
        "kind": "legacy-prototype",
        "legacy_id": "bioreactors-4:check",
        "modifications": []
      }
    },
    {
      "id": "bioreactors-1:doubling-time",
      "type": "numeric",
      "prompt": "A culture grows exponentially from 2.0×10⁵ to 1.28×10⁶ cells in 24 h. Calculate the doubling time. Enter a value and unit.",
      "points": 1,
      "objective_ids": [
        "bioreactors-1-objective-2"
      ],
      "solution_spec": {
        "answer": 8.962,
        "unit": "h",
        "tolerance": 0.05,
        "unit_required": true,
        "significant_figures": null,
        "dimensions": null
      },
      "feedback": {
        "hint": "Count doublings with log base 2 of the fold increase.",
        "solution": "Fold increase = 6.4, doublings = log2(6.4) = 2.678, doubling time = 24 h ÷ 2.678 = 8.96 h. The exponential model fails when nutrients, oxygen or space limit growth or toxic by-products accumulate.",
        "lesson_ids": [
          "bioreactors-1"
        ],
        "misconception_ids": []
      },
      "visibility": "public-practice-authoring",
      "provenance": {
        "kind": "original",
        "modifications": []
      }
    },
    {
      "id": "bioreactors-2:oxygen-supply-vs-demand",
      "type": "numeric",
      "prompt": "A bioreactor has kLa = 10 h⁻¹, saturation dissolved oxygen 0.20 mmol/L and bulk dissolved oxygen 0.10 mmol/L. The culture has 1.5×10¹⁰ cells/L, each consuming 1.0×10⁻¹⁰ mmol/h. Calculate the oxygen transfer rate minus the oxygen uptake rate in mmol/(L·h). A negative value means demand exceeds supply. Enter the number only.",
      "points": 1,
      "objective_ids": [
        "bioreactors-2-objective-2"
      ],
      "solution_spec": {
        "answer": -0.5,
        "unit": "",
        "tolerance": 0.02,
        "unit_required": false,
        "significant_figures": null,
        "dimensions": null
      },
      "feedback": {
        "hint": "OTR = kLa × (C* − C); OUR = cells per liter × uptake per cell.",
        "solution": "OTR = 10 × (0.20 − 0.10) = 1.00 mmol/(L·h) and OUR = 1.5×10¹⁰ × 1.0×10⁻¹⁰ = 1.50 mmol/(L·h), so the difference is -0.50. Demand exceeds the transfer capacity at this dissolved-oxygen level, so dissolved oxygen would fall.",
        "lesson_ids": [
          "bioreactors-2"
        ],
        "misconception_ids": []
      },
      "visibility": "public-practice-authoring",
      "provenance": {
        "kind": "original",
        "modifications": []
      }
    },
    {
      "id": "bioreactors-3:similarity-constraints",
      "type": "single_choice",
      "prompt": "A 2 L stirred bench reactor is scaled to 200 L by holding power per volume constant. Which statement is correct?",
      "options": [
        "All dimensionless groups are preserved because one was held constant.",
        "Power per volume is preserved, but tip speed, Reynolds number and mixing time generally change, so similarity holds only for the constraint that was kept.",
        "Scale-up by any single criterion preserves cell performance.",
        "Reynolds number is preserved automatically when volume increases."
      ],
      "points": 1,
      "objective_ids": [
        "bioreactors-3-objective-2"
      ],
      "solution_spec": {
        "answer": 1
      },
      "feedback": {
        "hint": "List what cannot all be matched at once when geometry and volume change.",
        "solution": "Different scale-up criteria (power per volume, tip speed, Reynolds number, mixing time) conflict, so holding one fixed changes the others. Dimensionless similarity is valid only for the groups that are actually preserved and relevant to the process.",
        "lesson_ids": [
          "bioreactors-3"
        ],
        "misconception_ids": []
      },
      "visibility": "public-practice-authoring",
      "provenance": {
        "kind": "original",
        "modifications": []
      }
    },
    {
      "id": "bioreactors-4:drift-vs-assay-variation",
      "type": "single_choice",
      "prompt": "A control reference sample measured by the same assay every week for ten weeks stays within ±2% of 100, while batch titres fall from 100 to 80 over the same period. What is the best interpretation?",
      "options": [
        "Assay variation is small compared with the 20% decline, so the drift is more likely a process change that needs investigation.",
        "The decline is assay noise because assays always vary.",
        "Nothing can be concluded without changing the assay.",
        "The control proves the process is stable."
      ],
      "points": 1,
      "objective_ids": [
        "bioreactors-4-objective-2"
      ],
      "solution_spec": {
        "answer": 0
      },
      "feedback": {
        "hint": "Compare the size of assay scatter with the size of the trend.",
        "solution": "A stable control bounds assay variation near ±2%, far smaller than the 20% change in titres, which points to a process change; the cause (raw materials, cells, operation) still has to be found. A single control does not cover every assay failure mode.",
        "lesson_ids": [
          "bioreactors-4"
        ],
        "misconception_ids": []
      },
      "visibility": "public-practice-authoring",
      "provenance": {
        "kind": "original",
        "modifications": []
      }
    }
  ]
}
